[
  {
    "recordId": "coloplast-speedicath-short-sample",
    "field": "sourceUrl",
    "hostname": "products.coloplast.co.za",
    "url": "https://products.coloplast.co.za/global-campaigns/speedicath-short/",
    "reason": "official_source_verified_despite_automated_access_block",
    "verifiedAt": "2026-07-14",
    "expiresAt": "2026-07-21",
    "evidenceSummary": "Official Coloplast South Africa campaign displayed a free SpeediCath Short sample form and stated that requests are qualified and verified for product suitability."
  },
  {
    "recordId": "coloplast-speedicath-short-sample",
    "field": "termsUrl",
    "hostname": "products.coloplast.co.za",
    "url": "https://products.coloplast.co.za/webshop/terms-of-sale/",
    "reason": "official_source_verified_despite_automated_access_block",
    "verifiedAt": "2026-07-14",
    "expiresAt": "2026-07-21",
    "evidenceSummary": "Official Coloplast sample clauses stated that approved sample requests are dispatched separately within three business days and receive free delivery in South Africa."
  },
  {
    "recordId": "coloplast-speedicath-short-sample",
    "field": "sourceUrl",
    "hostname": "products.coloplast.co.za",
    "url": "https://products.coloplast.co.za/global-campaigns/speedicath-short/",
    "reason": "official_source_verified_despite_automated_access_block",
    "verifiedAt": "2026-07-23",
    "expiresAt": "2026-07-30",
    "evidenceSummary": "Official Coloplast South Africa campaign still displayed the free SpeediCath Short sample form, stated that requests are qualified and verified for suitability, and limited requests to people who use or have been prescribed an intermittent catheter."
  },
  {
    "recordId": "coloplast-speedicath-short-sample",
    "field": "termsUrl",
    "hostname": "products.coloplast.co.za",
    "url": "https://products.coloplast.co.za/webshop/terms-of-sale/",
    "reason": "official_source_verified_despite_automated_access_block",
    "verifiedAt": "2026-07-23",
    "expiresAt": "2026-07-30",
    "evidenceSummary": "Official Coloplast sample clauses still stated that suitability-approved samples are dispatched separately within three business days with free delivery and discreet packaging from Coloplast South Africa."
  },
  {
    "recordId": "brand-advisor-parmalat-easygest-testing",
    "field": "sourceUrl",
    "hostname": "brandadvisor.co.za",
    "url": "https://brandadvisor.co.za/parmalat-easygest-fb-event-landing-page/",
    "reason": "official_source_verified_despite_automated_access_block",
    "verifiedAt": "2026-07-23",
    "expiresAt": "2026-07-30",
    "evidenceSummary": "Official Brand Advisor application page invited 150 Instagram creators with at least 1,000 followers to apply for a Parmalat EasyGest hamper in exchange for two Instagram reels."
  },
  {
    "recordId": "brand-advisor-kinder-testing",
    "field": "sourceUrl",
    "hostname": "brandadvisor.co.za",
    "url": "https://brandadvisor.co.za/kinder-fb-event-landing-page/",
    "reason": "official_source_manually_reviewed",
    "verifiedAt": "2026-07-23",
    "expiresAt": "2026-07-30",
    "evidenceSummary": "Official Brand Advisor application page invited 100 Instagram creators with at least 1,000 followers to apply for a Kinder hamper in exchange for one family-focused Instagram reel."
  },
  {
    "recordId": "brand-advisor-sunlight-dishwashing-testing",
    "field": "sourceUrl",
    "hostname": "brandadvisor.co.za",
    "url": "https://brandadvisor.co.za/sunlight-dishwashing-liquid-fb-event-landing-page/",
    "reason": "official_source_manually_reviewed",
    "verifiedAt": "2026-07-23",
    "expiresAt": "2026-07-30",
    "evidenceSummary": "Official Brand Advisor application page invited 250 TikTok creators with at least 1,000 followers to apply for a Sunlight hamper in exchange for two TikTok videos."
  },
  {
    "recordId": "brand-advisor-clover-krush-testing",
    "field": "sourceUrl",
    "hostname": "brandadvisor.co.za",
    "url": "https://brandadvisor.co.za/clover-krush-fb-event-landing-page/",
    "reason": "official_source_manually_reviewed",
    "verifiedAt": "2026-07-23",
    "expiresAt": "2026-07-30",
    "evidenceSummary": "Official Brand Advisor application page invited Instagram creators with at least 1,000 followers and an active TikTok presence to apply for a Clover Krush hamper in exchange for two Instagram posts."
  },
  {
    "recordId": "coloplast-speedicath-short-sample",
    "field": "sourceUrl",
    "hostname": "products.coloplast.co.za",
    "url": "https://products.coloplast.co.za/global-campaigns/speedicath-short/",
    "reason": "official_source_verified_despite_automated_access_block",
    "verifiedAt": "2026-07-27",
    "expiresAt": "2026-08-03",
    "evidenceSummary": "Official Coloplast South Africa campaign returned HTTP 200 and still displayed the free SpeediCath Short application, qualification wording and provider consent route."
  },
  {
    "recordId": "coloplast-speedicath-short-sample",
    "field": "termsUrl",
    "hostname": "products.coloplast.co.za",
    "url": "https://products.coloplast.co.za/webshop/terms-of-sale/",
    "reason": "official_source_verified_despite_automated_access_block",
    "verifiedAt": "2026-07-27",
    "expiresAt": "2026-08-03",
    "evidenceSummary": "Official Coloplast South Africa terms still supported separate dispatch and free delivery for approved sample requests."
  },
  {
    "recordId": "brand-advisor-parmalat-easygest-testing",
    "field": "sourceUrl",
    "hostname": "brandadvisor.co.za",
    "url": "https://brandadvisor.co.za/parmalat-easygest-fb-event-landing-page/",
    "reason": "official_source_manually_reviewed",
    "verifiedAt": "2026-07-27",
    "expiresAt": "2026-08-03",
    "evidenceSummary": "Official Brand Advisor page returned HTTP 200 and retained its active application survey, follower threshold, hamper and two-Reel requirement."
  },
  {
    "recordId": "brand-advisor-kinder-testing",
    "field": "sourceUrl",
    "hostname": "brandadvisor.co.za",
    "url": "https://brandadvisor.co.za/kinder-fb-event-landing-page/",
    "reason": "official_source_manually_reviewed",
    "verifiedAt": "2026-07-27",
    "expiresAt": "2026-08-03",
    "evidenceSummary": "Official Brand Advisor page returned HTTP 200 and retained its active application survey, follower threshold, Kinder hamper and family-focused Reel requirement."
  },
  {
    "recordId": "brand-advisor-sunlight-dishwashing-testing",
    "field": "sourceUrl",
    "hostname": "brandadvisor.co.za",
    "url": "https://brandadvisor.co.za/sunlight-dishwashing-liquid-fb-event-landing-page/",
    "reason": "official_source_manually_reviewed",
    "verifiedAt": "2026-07-27",
    "expiresAt": "2026-08-03",
    "evidenceSummary": "Official Brand Advisor page returned HTTP 200 and retained its active application survey, follower threshold, Sunlight hamper and two-video requirement."
  },
  {
    "recordId": "brand-advisor-clover-krush-testing",
    "field": "sourceUrl",
    "hostname": "brandadvisor.co.za",
    "url": "https://brandadvisor.co.za/clover-krush-fb-event-landing-page/",
    "reason": "official_source_manually_reviewed",
    "verifiedAt": "2026-07-27",
    "expiresAt": "2026-08-03",
    "evidenceSummary": "Official Brand Advisor page returned HTTP 200 and retained its application survey, account conditions, Clover Krush hamper and two-post requirement."
  },
  {
    "recordId": "brand-advisor-sta-soft-parfum-testing",
    "field": "sourceUrl",
    "hostname": "brandadvisor.co.za",
    "url": "https://brandadvisor.co.za/sta-soft-parfum-project/",
    "reason": "official_source_manually_reviewed",
    "verifiedAt": "2026-07-27",
    "expiresAt": "2026-08-03",
    "evidenceSummary": "Official Brand Advisor page returned HTTP 200 and displayed an active survey for creators with at least 1,000 followers to receive a voucher in exchange for one Instagram Reel or TikTok video."
  },
  {
    "recordId": "brand-advisor-clover-nolac-testing",
    "field": "sourceUrl",
    "hostname": "brandadvisor.co.za",
    "url": "https://brandadvisor.co.za/clover-nolac-project-2/",
    "reason": "official_source_manually_reviewed",
    "verifiedAt": "2026-07-27",
    "expiresAt": "2026-08-03",
    "evidenceSummary": "Official Brand Advisor page returned HTTP 200 and displayed an active Clover Nolac survey with the dairy-suitability context, 1,000-follower threshold, hamper and one-video requirement."
  },
  {
    "recordId": "brand-advisor-clover-barley-milk-testing",
    "field": "sourceUrl",
    "hostname": "brandadvisor.co.za",
    "url": "https://brandadvisor.co.za/clover-barley-milk-project/",
    "reason": "official_source_manually_reviewed",
    "verifiedAt": "2026-07-27",
    "expiresAt": "2026-08-03",
    "evidenceSummary": "Official Brand Advisor page returned HTTP 200 and displayed an active alternative-milk survey with the 1,000-follower threshold, Clover hamper and one-post requirement."
  },
  {
    "recordId": "brand-advisor-super-c-sweets-testing",
    "field": "sourceUrl",
    "hostname": "brandadvisor.co.za",
    "url": "https://brandadvisor.co.za/super-c-sweets-project/",
    "reason": "official_source_manually_reviewed",
    "verifiedAt": "2026-07-27",
    "expiresAt": "2026-08-03",
    "evidenceSummary": "Official Brand Advisor page returned HTTP 200 and displayed an active Super C survey with the active-lifestyle fit, 1,000-follower threshold, hamper and one-post requirement."
  },
  {
    "recordId": "brand-advisor-clover-onion-slices-testing",
    "field": "sourceUrl",
    "hostname": "brandadvisor.co.za",
    "url": "https://brandadvisor.co.za/clover-onion-project/",
    "reason": "official_source_manually_reviewed",
    "verifiedAt": "2026-07-27",
    "expiresAt": "2026-08-03",